patentID,grantdate,appldate,patent_title,country,firmID
8949328,20150203,20110713,Performing collective operations in a distributed processing system,US,6066
10522781,20191231,20180611,Electroluminescence device and display device,JP,9818
9142730,20150922,20140522,Method of manufacturing semiconductor light emitting device,KR,104604
10304995,20190528,20140306,Flexible electric device and method of manufacturing the same,KR,104604
9505250,20161129,20150512,Image forming system and network management device including an image forming apparatus and an accessory device,JP,2721
8412931,20130402,20071227,Techniques for credential strength analysis via failed intruder access attempts,US,1690
9712302,20170718,20150529,Frame structure design for new carrier type (NCT),US,6008
10462411,20191029,20180423,Techniques for video analytics of captured video content,US,6008
9934863,20180403,20170112,Dynamically adjusting read voltage in a NAND flash memory,US,6066
8913140,20141216,20120829,Rolling shutter reduction based on motion sensors,US,1690
9645516,20170509,20151109,"Electrophotographic photosensitive member, process cartridge and electrophotographic apparatus",JP,2721
8653597,20140218,20130111,Solutions for controlling bulk bias voltage in an extremely thin silicon-on-insulator (ETSOI) integrated circuit chip,US,6066
8750327,20140610,20130809,"Wireless communication system, wireless communication apparatus, wireless communication method, and computer program",JP,9818
9536493,20170103,20140924,Display apparatus and method of controlling display apparatus,KR,104604
9865698,20180109,20160225,Semiconductor device blocking leakage current and method of forming the same,KR,104604
8429193,20130423,20090109,Security control of analysis results,US,6066
10316165,20190611,20170921,Non-halogenated flame retardant hindered amine light stabilizer cross-linkers,US,6066
8401200,20130319,20091119,Electronic device and headset with speaker seal evaluation capabilities,US,1690
9917005,20180313,20170221,Semiconductor structure with airgap,US,6066
8891473,20141118,20121109,Deduplicated data processing congestion control,US,6066
9147403,20150929,20121214,Responding to a call to action contained in an audio signal,US,24800
9697538,20170704,20160919,Product recommendations based on analysis of social experiences,US,6066
8932736,20150113,20110210,Organic compound and organic light-emitting device,JP,2721
9086831,20150721,20140725,Information processing system comprising one or more apparatuses which manage job information of a job,JP,2721
9130952,20150908,20140206,Method and apparatus for searching metadata,US,1690
10042760,20180807,20160603,Scalable cloud storage architecture,US,6066
8990442,20150324,20121120,Configuring signals based on device conditions,US,6008
9607118,20170328,20160419,Evaluating on-chip voltage regulation,US,6066
9384883,20160705,20140114,Nested through glass via transformer,US,24800
9898104,20180220,20161101,"Electronic terminal, input correction method, and program",JP,9818
9934028,20180403,20170109,Tracking changes within javascript object notation,US,6066
9420286,20160816,20130613,Temporal motion vector prediction in HEVC and its extensions,US,24800
9946327,20180417,20150219,Thermal mitigation with power duty cycle,US,24800
8913508,20141216,20100830,Real-time charging system and method for managing QoS and charging rule of service,KR,104604
8693940,20140408,20120329,"Control apparatus, control method for control apparatus, and storage medium",JP,2721
10324865,20190618,20160906,Maintaining ordering requirements while converting protocols in a communications fabric,US,1690
9544571,20170110,20120322,"Image pickup unit, image pickup device, picture processing method, diaphragm control method, and program",JP,9818
8421239,20130416,20100316,Crenulated wiring structure and method for integrated circuit interconnects,US,6066
9906464,20180227,20141204,Optimization of multimedia service over an IMS network,US,6066
8513731,20130820,20091016,Vertical type semiconductor device,KR,104604
9812557,20171107,20160426,Method of manufacturing semiconductor device,KR,104604
8871383,20141028,20120713,Cell,JP,9818
8994741,20150331,20130226,Streaming translation in display pipe,US,1690
10476667,20191112,20180929,"SM4 acceleration processors, methods, systems, and instructions",US,6008
9313753,20160412,20090630,Method and device for controlling hand-over message transmission power in a mobile communications system,KR,104604
10366035,20190730,20170329,Single wire communication board-to-board interconnect,US,6008
9590089,20170307,20111230,Variable gate width for gate all-around transistors,US,6008
8617991,20131231,20120619,Method of manufacturing semiconductor device,KR,104604
10459125,20191029,20170215,"Optical member, method for manufacturing optical member, and optical film of optical member",JP,2721
10061857,20180828,20180226,Detecting and grouping users in electronic communications,US,6066
10136110,20181120,20161013,Low-light image quality enhancement method for image processing device and method of operating image processing system performing the method,KR,104604
8838927,20140916,20110527,"Systems, methods, and physical computer storage media to optimize data placement in multi-tiered storage systems",US,6066
9058890,20150616,20130625,Over-sampling read operation for a flash memory device,KR,104604
9917818,20180313,20140930,Multi-tenant secure separation of data in a cloud-based application,US,6066
9273906,20160301,20120614,Modular pumping unit(s) facilitating cooling of electronic system(s),US,6066
10355743,20190716,20180117,Frequency hopping design for large bandwidth allocations in eMTC,US,24800
10128917,20181113,20150914,Systems and methods for tone plans for wireless communication networks,US,24800
9794956,20171017,20140113,Mobile communication terminal device and method for selecting a virtual carrier for machine-type communications based on measurements of channel conditions,JP,9818
9324180,20160426,20131209,Culling using masked depths,US,6008
9274580,20160301,20120629,Voltage regulator supplying power exclusively to a non-core region of a processor having a supply capability threshold,US,6008
8588002,20131119,20100706,Nonvolatile memory devices and programming methods thereof in which a program inhibit voltage is changed during programming,KR,104604
8630403,20140114,20120309,Controlling hold queue position adjustment,US,6066
9183931,20151110,20140722,Resistive memory device capable of increasing sensing margin by controlling interface states of cell transistors,KR,104604
9953033,20180424,20140912,Wireless content synchronization,US,1690
10216107,20190226,20171228,Toner and method of producing toner,JP,2721
8419433,20130416,20080415,Monitoring recipe preparation using interactive cooking device,US,6066
9544897,20170110,20130415,Peak-to-average power ratio management for multi-carrier modulation in wireless communication systems,US,24800
8940449,20150127,20070201,Fuel cell,JP,2721
9442829,20160913,20160304,Detecting error states when interacting with web applications,US,6066
8702001,20140422,20121017,Apparatus and method for acquiring code image in a portable terminal,KR,104604
8441555,20130514,20120329,"Image capturing apparatus with electronic zoom and recording size setting, and control method and program therefor",JP,2721
9535564,20170103,20140325,Visualization of runtime resource policy attachments and applied policy details,US,6066
10049120,20180814,20150708,Consistency based access of data in a dispersed storage network,US,6066
8912013,20141216,20121219,Magnetic tunnel junction device and fabrication,US,24800
10169260,20190101,20171215,Multiprocessor cache buffer management,US,6066
9495389,20161115,20130315,Client-server based dynamic search,US,24800
8868627,20141021,20100125,"Information processing apparatus, information processing method, and program",JP,9818
8752022,20140610,20110224,Thread-specific event management in a non-stop debugging environment,US,6066
8384076,20130226,20090514,"Transistors, semiconductor devices and methods of manufacturing the same",KR,104604
10345678,20190709,20180730,Sum frequency generator in the microwave domain for quantum communication and computation applications,US,6066
10419538,20190917,20160426,Selecting memory for data access in a dispersed storage network,US,6066
8428167,20130423,20120813,Method of estimating the symbols of a digital signal and receiver for implementing said method,US,1690
9202287,20151201,20130923,Apparatus and method for processing color image using depth image,KR,104604
10425666,20190924,20101112,Method and apparatus for adaptive streaming using segmentation,KR,104604
9268108,20160223,20131223,Lens barrel capable of suppressing variation of attitude of optical element and image pickup apparatus using the same,JP,2721
8426319,20130423,20080528,Composition for etching a metal hard mask material in semiconductor processing,US,6008
9203147,20151201,20121220,Inverse beamformer for inverting the action of existing beamformer in communication system,US,1690
8520119,20130827,20120607,"Imaging apparatus and video camera, and method of reproducing recorded information performed by the imaging apparatus or the video camera",JP,2721
9778660,20171003,20150916,Unmanned aerial vehicle low-power operation,US,24800
8406803,20130326,20100727,Multi-cell communication apparatus and method using rate-splitting scheme and transmission frame,KR,104604
9251794,20160202,20130207,"Signal processing apparatus, signal processing method, program, electronic device, signal processing system and signal processing method thereof",JP,9818
10304802,20190528,20160502,Integrated wafer-level processing system,US,6066
9342415,20160517,20140714,Run-to-completion thread model for software bypass fail open for an inline intrusion protection system,US,6066
10018662,20180710,20160323,Networked electrostatic discharge measurement,US,6066
10219256,20190226,20151230,Control information feedback for eCC on PCell,US,24800
10146680,20181204,20140312,Data processing system and method of operating the same,KR,104604
9548466,20170117,20130620,Method of forming a thin film and an electronic device,KR,104604
9042098,20150526,20121112,Air-cooling and vapor-condensing door assembly,US,6066
9972711,20180515,20150603,Reduced resistance short-channel InGaAs planar MOSFET,US,6066
9473149,20161018,20160108,Temperature-compensated signal generator for supply voltage monitoring,US,24800
10169029,20190101,20170110,Pattern based migration of integration applications,US,6066
9900171,20180220,20140221,"Methods to discover, configure, and leverage relationships in internet of things (IoT) networks",US,24800
9507326,20161129,20150827,System and method for using biometrics to predict and select music preferences,US,6066
8483290,20130709,20100114,Method and system for data management in a video decoder,US,6008
9311388,20160412,20120814,Semantic and contextual searching of knowledge repositories,US,6066
8913600,20141216,20040107,"Wireless communication apparatus, system, and device communicating with another wireless communication apparatus, system, and device in an autonomous distributed network without a designated control station and method thereof",JP,9818
8992031,20150331,20110818,Imaging apparatus,JP,2721
8856453,20141007,20120301,Persistent prefetch data stream settings,US,6066
10003679,20180619,20170630,"Housing, manufacturing method thereof, and electronic device including the housing",KR,104604
9762929,20170912,20131113,"Content adaptive, characteristics compensated prediction for next generation video",US,6008
10229088,20190312,20160421,Application processor and system on chip,KR,104604
8867581,20141021,20130108,Semiconductor laser and method of manufacturing the same,JP,9818
8492274,20130723,20121017,Metal alloy cap integration,US,6066
9851582,20171226,20150817,Zoom lens and image pickup apparatus including the same,JP,2721
9513947,20161206,20141024,Adaptive virtual machine request approver,US,6066
9733548,20170815,20160407,Focal-plane shutter and image capturing apparatus,JP,2721
9256152,20160209,20131010,Image processing apparatus and method having viewing-density priority and color material saving modes,JP,2721
10332212,20190625,20161026,Automation and validation of insurance claims for infrastructure risks and failures in multi-processor computing environments,US,6066
10165163,20181225,20150720,"Image pickup apparatus including mechanism for attaching and detaching transparent cover, image processing method thereof, and storage medium",JP,2721
8626881,20140107,20111216,Distributed mesh network,US,6008
10163192,20181225,20161021,Image encoding apparatus and method of controlling the same,JP,2721
10224419,20190305,20171127,Threshold voltage modulation through channel length adjustment,US,6066
9946771,20180417,20140930,User interface for searching,US,1690
10268366,20190423,20160603,Touch-based interactive learning environment,US,1690
9967649,20180508,20160922,Wireless pairing of earbuds and case,US,1690
8835257,20140916,20111206,Method of fabricating semiconductor device including a recessed channel,KR,104604
10257023,20190409,20160415,Dual server based storage controllers with distributed storage of each server data in different clouds,US,6066
9552187,20170124,20151202,System and method for display mirroring,US,1690
9250888,20160202,20121127,Migration package for updating multiple software products,US,6066
10025020,20180717,20160421,Backlight apparatus and 3D image display apparatus including the same,KR,104604
10440262,20191008,20150113,Electronic device and method for processing image,KR,104604
9794445,20171017,20160714,Image forming apparatus,JP,2721
10380187,20190813,20151030,"System, method, and recording medium for knowledge graph augmentation through schema extension",US,6066
8767079,20140701,20101213,Image capture apparatus and control method thereof,JP,2721
8909877,20141209,20120202,Dynamic real storage usage control,US,6066
9861253,20180109,20140804,"Water softening apparatus, dishwasher having the same and control method thereof",KR,104604
8625300,20140107,20120905,Circuit manufacturing and design techniques for reference plane voids with strip segment,US,6066
9622246,20170411,20140929,Scrambling sequence generation in a communication system,US,24800
9709706,20170718,20140221,"Optical unit, imaging device, electronic apparatus, and master",JP,9818
10114444,20181030,20160815,Electronic device having an active edge,US,6008
9692997,20170627,20160328,Pixel readout architecture for full well capacity extension,US,24800
9767194,20170919,20111107,Media file abbreviation retrieval,US,6066
8949342,20150203,20080314,Messaging system,US,1690
8703592,20140422,20110321,Methods of forming semiconductor devices having faceted semiconductor patterns,KR,104604
8644736,20140204,20100405,Developing apparatus,JP,2721
10341601,20190702,20170919,"Image processing apparatus, imaging apparatus, and image processing method",JP,2721
9374830,20160621,20130129,"Communication control device, communication control method, and base station",JP,9818
9337029,20160510,20150409,Structure including gallium nitride substrate and method of manufacturing the gallium nitride substrate,KR,104604
9572187,20170214,20150122,"Information processing apparatus, information processing method, and program",JP,9818
9041448,20150526,20130305,Flip-flops in a monolithic three-dimensional (3D) integrated circuit (IC) (3DIC) and related methods,US,24800
8488709,20130716,20100830,Providing CQI feedback with common code rate to a transmitter station,US,6008
9546872,20170117,20160229,Hybrid road network and grid based spatial-temporal indexing under missing road links,US,6066
8644155,20140204,20090123,Multi-hop wireless terminal and traffic control method thereof,JP,9818
9929517,20180327,20170526,Connectors with switchable terminal loads,US,6008
9280448,20160308,20130311,Controlling operation of a run-time instrumentation facility from a lesser-privileged state,US,6066
9502504,20161122,20131219,SOI lateral bipolar transistors having surrounding extrinsic base portions,US,6066
9647323,20170509,20150612,Electronic device with antenna having ring-type structure,KR,104604
10338970,20190702,20160920,Multi-platform scheduler for permanent and transient applications,US,6066
8423652,20130416,20120627,Service templates for an IP multimedia subsystem,US,1690
9858099,20180102,20140428,Administering virtual machines in a distributed computing environment,US,6066
10043125,20180807,20150406,Smart ring,US,24800
9519397,20161213,20130830,Data display method and apparatus,KR,104604
10199524,20190205,20120113,Field-effect photovoltaic elements,US,6066
10228630,20190312,20170907,Toner and method of producing toner,JP,2721
9421543,20160823,20120329,"Hydrodynamic filter unit, hydrodynamic filter including the hydrodynamic filter unit, and method of filtering target material by using the hydrodynamic filter unit and the hydrodynamic filter",KR,104604
9575556,20170221,20121025,"Information processing apparatus and method, information processing system, and providing medium",JP,9818
8874856,20141028,20110617,Apparatus and method for detecting false sharing,KR,104604
8949746,20150203,20091112,Providing access for blind users on kiosks,US,6066
9344710,20160517,20140930,"Image signal processing device, transmitting device, image signal processing method, program and image signal processing system",JP,9818
9513836,20161206,20160303,Migration of data to sequential access medium,US,6066
9088458,20150721,20130715,Method and apparatus for notifying remote user interface client about event of remote user interface server in home network,KR,104604
9348423,20160524,20140825,Integrated processor for 3D mapping,US,1690
10282207,20190507,20160218,Multi-slice processor issue of a dependent instruction in an issue queue based on issue of a producer instruction,US,6066
8810676,20140819,20111011,"Analog to digital converters, image sensor systems, and methods of operating the same",KR,104604
8930954,20150106,20100810,Scheduling parallel data tasks,US,6066
9037802,20150519,20120530,Methods for managing a cache in a multi-node virtual tape controller,US,6066
8930541,20150106,20111125,"System, method and program product for cost-aware selection of templates for provisioning shared resources",US,6066
8639108,20140128,20130107,Imaging apparatus and method for controlling same,JP,2721
8514703,20130820,20101111,Scheduling of logical channels in a wireless communication system,US,24800
10175522,20190108,20151209,"Optical deflection diffusion sheet, laminated optical deflection diffusion sheet, laminated optical sheet, and liquid crystal display device using same",KR,104604
10224368,20190305,20170630,Voltage-switched magneto-resistive random access memory (MRAM) employing separate read operation circuit paths from a shared spin torque write operation circuit path,US,24800
9391233,20160712,20140124,Method for manufacturing light emitting device package,KR,104604
9712305,20170718,20101012,Method and apparatus for transmitting and receiving multi-user control channels in a wireless communication system with multiple antennas,KR,104604
9819364,20171114,20150921,Apparatus and method for transmitting/receiving signal in communication system supporting bit-interleaved coded modulation with iterative decoding scheme,KR,104604
8595044,20131126,20080529,Determining competence levels of teams working within a software,US,6066
10223278,20190305,20160922,Selective bypassing of allocation in a cache,US,24800
8787172,20140722,20100621,Method and apparatus for QoS context transfer during inter radio access technology handover in a wireless communication system,US,24800
8868871,20141021,20131001,Synchronous extent migration protocol for paired storage,US,6066
10396033,20190827,20180723,First power buses and second power buses extending in a first direction,US,24800
8969984,20150303,20131008,Magnetic tunnel junction device,US,24800
10346642,20190709,20180307,Keyboard entry as an abbreviation to a contemporaneous gesture authentication,US,6066
9585287,20170228,20141021,"Electronic component, electronic apparatus, and method for manufacturing the electronic component",JP,2721
9943046,20180417,20140929,Targeted irrigation using a central pivot irrigation system with a sensor network,US,6066
10235327,20190319,20170526,Digital interconnects with protocol-agnostic repeaters,US,6008
9578299,20170221,20120113,Stereoscopic conversion for shader based graphics content,US,24800
10142218,20181127,20110114,Hypervisor routing between networks in a virtual networking environment,US,6066
10462363,20191029,20180222,Optical apparatus,JP,2721
8871624,20141028,20130116,Sealed air gap for semiconductor chip,US,6066
8751519,20140610,20120619,Image processing apparatus and method for controlling image processing apparatus,JP,2721
8679650,20140325,20091001,Substrate for growing wurtzite type crystal and method for manufacturing the same and semiconductor device,JP,2721
8854448,20141007,20130604,"Image processing apparatus, image display system, and image processing method and program",JP,2721
9391779,20160712,20080728,Reactive biometric single sign-on utility,US,6066
8933890,20150113,20070801,Techniques for interactive input to portable electronic devices,US,1690
8891953,20141118,20101229,"Apparatus, medium, and method for photographing based on face detection",KR,104604
10078629,20180918,20151022,Tabular data compilation,US,6066
10073201,20180911,20121026,See through near-eye display,US,24800
8891725,20141118,20130429,Frequency divider with improved linearity for a fractional-N synthesizer using a multi-modulus prescaler,US,24800
8548354,20131001,20120824,Process cartridge including developing roller and electrophotographic photosensitive member that can be contacted to and spaced from each other,JP,2721
10040794,20180807,20150318,Condensed cyclic compound and organic light-emitting device including the same,KR,104604
10313482,20190604,20141016,"Method, device and system for providing services based on location information and terminal device thereon",KR,104604
10468134,20191105,20141003,Medical imaging apparatus for displaying portions of x-ray images and method for displaying medical image,KR,104604
10310813,20190604,20141229,Hardware implementation of a tournament tree sort algorithm using an external memory,US,6066
9721946,20170801,20161019,Backside coupled symmetric varactor structure,US,24800
10448346,20191015,20170922,Synchronization signal design,US,24800
9335847,20160510,20140321,Object display method and apparatus of portable electronic device,KR,104604
9354385,20160531,20131023,Curved display apparatus,KR,104604
9559107,20170131,20150520,Structure and method for BEOL nanoscale damascene sidewall-defined non-volatile memory element,US,6066
9183913,20151110,20140604,Methods of operating a magnetic memory device,KR,104604
9985477,20180529,20140910,"Power transmitting apparatus, power receiving apparatus, control methods therefor, program, and computer-readable storage medium",JP,2721
8383468,20130226,20120405,"Display device and manufacturing method thereof, and semiconductor device and manufacturing method thereof",JP,9818
10484070,20191119,20190517,Method and apparatus for channel state information reference signal (CSI-RS),KR,104604
9558807,20170131,20150623,Apparatuses and systems for increasing a speed of removal of data stored in a memory cell,US,6008
10021701,20180710,20131226,Wireless communication method and wireless communication device,JP,9818
9001216,20150407,20121012,Method and apparatus for video streaming,JP,9818
8750209,20140610,20110624,System and method for switching mobile station identification in wireless communication system,KR,104604
9171608,20151027,20130711,"Three-dimensional (3D) memory cell separation among 3D integrated circuit (IC) tiers, and related 3D integrated circuits (3DICS), 3DIC processor cores, and methods",US,24800
8894800,20141125,20130226,Polymeric edge seal for bonded substrates,US,6066
8791562,20140729,20110715,Stack package and semiconductor package including the same,KR,104604
9490130,20161108,20150601,Method of manufacturing three-dimensional semiconductor memory device in which an oxide layer is formed at bottom of vertical structure of the device,KR,104604
8809993,20140819,20130221,Semiconductor device having isolation region,KR,104604
9438842,20160906,20131205,"Reproduction control apparatus, reproduction control method, and storage medium",JP,2721
10014931,20180703,20080111,Method and system for transmitting and receiving signal using multiple frequency bands in a wireless communication system,KR,104604
9258836,20160209,20131226,"Information processing apparatus, control method therefor, and recording medium",JP,2721
9649853,20170516,20160708,Image processing apparatus and method for processing image,JP,2721
9565123,20170207,20151005,Methods and systems for scheduling OFDM frames,US,1690
10373905,20190806,20180412,Integrating metal-insulator-metal capacitors with air gap process flow,US,6066
8502085,20130806,20070914,Multi-layer substrate with a via hole and electronic device having the same,KR,104604
9449173,20160920,20140923,Techniques for enabling co-existence of multiple security measures,US,6008
9800561,20171024,20141106,Secure sharing of user annotated subscription media with trusted devices,US,6008
9315026,20160419,20150812,Method for manufacturing liquid discharge head,JP,2721
8683158,20140325,20051230,Steering system management code region accesses,US,6008
9485068,20161101,20141105,Method and apparatus for mitigating pilot pollution in a wireless network,US,24800
10521359,20191231,20170508,Secure distance computations,US,6066
