patentID,grantdate,appldate,patent_title,country,firmID
8620154,20131231,20100716,Methods and apparatus for fast and energy-efficient light recovery in a visible light communication (VLC) system,KR,104604
8442441,20130514,20050729,Traffic interference cancellation,US,24800
8665834,20140304,20081201,Method and apparatus for transceiving data using directional beam in wireless personal area network,KR,104604
8386211,20130226,20080815,Monitoring virtual worlds to detect events and determine their type,US,6066
9361007,20160607,20140917,Graphical interface data fragment operations for data visualization,US,6066
8930185,20150106,20100712,"Speech feature extraction apparatus, speech feature extraction method, and speech feature extraction program",US,6066
8799558,20140805,20111014,Indexing method for flash memory,KR,104604
10291366,20190514,20170522,"Method, user equipment and base station for controlling discontinuous reception (DRX) in wireless communication system",KR,104604
9767787,20170919,20140101,Artificial utterances for speaker verification,US,6066
9802410,20171031,20120724,Ink jet print head,JP,2721
9251828,20160202,20120704,Servo control,US,6066
9246435,20160126,20150209,Method to pre-charge crystal oscillators for fast start-up,US,24800
9296580,20160329,20140714,"Auto document feeder, scanner including the same, and method of controlling auto document feeding",KR,104604
8914801,20141216,20100527,"Hardware instructions to accelerate table-driven mathematical computation of reciprocal square, cube, forth root and their reciprocal functions, and the evaluation of exponential and logarithmic families of functions",US,6066
9313251,20160412,20150219,Sharing a configuration state of a client device that meets a threshold level of QoE,US,6066
8903966,20141202,20110601,Re-programming programmable hardware devices without system downtime,US,6066
9574294,20170221,20150225,Washing machine using bubbles,KR,104604
8953231,20150210,20131211,Document reading apparatus and document reading method,JP,2721
10386992,20190820,20131204,Display device for executing a plurality of applications and method for controlling the same,KR,104604
8503678,20130806,20091223,Suppressing power supply noise using data scrambling in double data rate memory systems,US,6008
9467121,20161011,20140826,Apparatus and method for compensating for process variation in electronic device,KR,104604
10317615,20190611,20171227,Outdoor display apparatus,KR,104604
10027675,20180717,20171214,Determining virtual adapter access controls in a computing environment,US,6066
8509159,20130813,20080115,Method and system for wireless communication using out-of-band channels,KR,104604
9891829,20180213,20170306,Storage of data with verification in a dispersed storage network,US,6066
8762864,20140624,20080806,Background removal tool for a presentation application,US,1690
10198472,20190205,20160609,Outer join optimizations in database management systems,US,6066
9621866,20170411,20140310,"Image processing apparatus, image processing method, and program",JP,2721
9625837,20170418,20140709,Imprint apparatus and method of manufacturing article,JP,2721
10025059,20180717,20150706,Optical apparatus,JP,2721
10423246,20190924,20160621,Input device and electronic apparatus for receiving signal from the input device,KR,104604
9348282,20160524,20150630,Fixing member,JP,2721
9945956,20180417,20150908,GNSS positioning using three-dimensional building models,US,1690
8898422,20141125,20120827,Workload-aware distributed data processing apparatus and method for processing large data based on hardware acceleration,KR,104604
9985939,20180529,20160517,"Server system, method of controlling server system, and storage medium, for providing a service based on authorization information",JP,2721
8547479,20131001,20121003,Display apparatus and control method thereof,JP,2721
8866916,20141021,20130812,"Image output apparatus, control method, and computer-readable storage medium for providing an output operation regardless of a connection state between apparatuses",JP,2721
10312341,20190604,20171128,Integrated circuit device and method of manufacturing the same,KR,104604
8836974,20140916,20110218,Image processing system and control method for managing a job related to image processing in a distributed environment,JP,2721
8969964,20150303,20131009,Embedded silicon germanium N-type field effect transistor for reduced floating body effect,US,6066
9288380,20160315,20140623,Imaging device and electronic apparatus,JP,9818
9240746,20160119,20120907,Driving apparatus for vibration-type actuator,JP,2721
10490184,20191126,20170616,Voice recognition apparatus and method,KR,104604
8736788,20140527,20060612,Liquid crystal display device having improved cooling efficiency,KR,104604
9886432,20180206,20150828,Parsimonious handling of word inflection via categorical stem + suffix N-gram language models,US,1690
8760192,20140624,20120629,Programmable circuit including differential amplifier circuit,KR,104604
9484529,20161101,20160414,Magnetic memory device,KR,104604
9471343,20161018,20150831,Dynamic code injection,US,6066
9558255,20170131,20140311,Managing replication configuration availability,US,6066
10382928,20190813,20160119,Internet of things device and communication method thereof,KR,104604
10103580,20181016,20160516,Wireless power transmission apparatus and method,KR,104604
9825751,20171121,20130522,"Communication control device, communication control method, program, terminal device, and communication control system",JP,9818
9224046,20151229,20150119,Multi-view object detection using appearance model transfer from similar scenes,US,6066
9560620,20170131,20150429,Methods and systems for enhanced round trip time (RTT) exchange,US,24800
9130958,20150908,20100728,"Terminal, seed server, and tracker server for reducing delay in streaming service",KR,104604
9569381,20170214,20141114,Scheduler for memory,KR,104604
9087148,20150721,20130819,Automated role adjustment in a computer system,US,6066
10002085,20180619,20151112,Peripheral component interconnect (PCI) device and system including the PCI,KR,104604
9783204,20171010,20150202,Cognitive displays,US,6066
9141406,20150922,20121003,Method and system to provide a user interface with respect to a plurality of applications,KR,104604
9818786,20171114,20160831,Imaging device including wirings that overlap photoelectric conversions units,JP,9818
8963587,20150224,20130514,Clock generation using fixed dividers and multiplex circuits,US,1690
9189486,20151117,20130307,Autonomic generation of document structure in a content management system,US,6066
8791888,20140729,20120914,"Pixel circuit, display device, driving method of pixel circuit, and driving method of display device",JP,9818
9073340,20150707,20111011,Ink jet printing apparatus and ink jet printing method with varied relative bias of printing permission ratio between print modes,JP,2721
8446917,20130521,20090528,Methods and apparatus for efficiently communicating information using a proxy,US,24800
9041783,20150526,20110121,"Shutter glasses, display apparatus and control method thereof",KR,104604
9152949,20151006,20060517,Methods and apparatus for identifying spam email,US,6066
9041283,20150526,20130827,Light-emitting device package,KR,104604
9621842,20170411,20160420,"Camera system, video processing apparatus, and camera apparatus",JP,9818
10434772,20191008,20180601,Printhead and printing apparatus,JP,2721
10310558,20190604,20170425,Apparatus and method for computing node and seat connection for conductive fabric,US,6008
9558121,20170131,20121228,Two-level cache locking mechanism,US,6008
9157991,20151013,20140716,Mechanism for proximity detection based on Wi-Fi signals,US,6008
9537675,20170103,20091103,Method and apparatus for transmitting and receiving personal broadcasting data based on peer-to-peer communication,KR,104604
9270400,20160223,20141027,Determining proximity of user equipment for device-to-device communication,US,6008
9064824,20150623,20131112,In-situ annealing for extending the lifetime of CMOS products,US,6066
9753862,20170905,20161025,Hybrid replacement policy in a multilevel cache memory hierarchy,US,6066
9243835,20160126,20120813,Refrigerator,KR,104604
9798745,20171024,20140913,"Methods, devices and systems for caching data items",KR,104604
9965219,20180508,20160225,Synchronizing a cursor based on consumer and producer throughputs,US,6066
10361078,20190723,20170727,Method of forming fine patterns of a semiconductor device,KR,104604
9767395,20170919,20151019,Image forming apparatus with copy history and control method for the same,JP,2721
10114593,20181030,20150722,"Information processing apparatus that requires authentication of user, control method therefor, and storage medium",JP,2721
8743297,20140603,20110921,Liquid crystal light adjusting device and imaging apparatus,JP,9818
9652006,20170516,20111221,Power management in a discrete memory portion,US,6008
8861610,20141014,20140113,Method and apparatus for encoding and decoding motion vector by obtaining motion vector predictor candidate using co-located block,KR,104604
9407700,20160802,20140617,Intelligent discovery of network information from multiple information gathering agents,US,6066
9692658,20170627,20140709,"Wireless network monitoring device, method and device in wireless communication system",JP,9818
9736834,20170815,20140922,"Apparatus, method, and system of inter-node communication",US,6008
8830753,20140909,20110729,"NonVolatile memory devices, methods of programming the same, and memory systems including the same",KR,104604
9291946,20160322,20140911,"Developing device having overlapping seal members, and process cartridge",JP,2721
9292560,20160322,20140828,Reducing collisions within a hash table,US,6066
9653040,20170516,20161122,Display driver capable of driving multiple display interfaces,US,6008
8717324,20140506,20130221,Method of interfacing with multi-point display device,JP,2721
9515031,20161206,20111229,Mitigation of far-end crosstalk induced by routing and out-of-plane interconnects,US,6008
9046617,20150602,20111025,Radiation imaging apparatus,JP,2721
8995359,20150331,20100916,Method and apparatus to facilitate support for multi-radio coexistence,US,24800
10455456,20191022,20180202,Method and apparatus for transmitting data in a mobile communication system,KR,104604
9983511,20180529,20161020,Image forming apparatus having reverse developer feeding,JP,2721
10459809,20191029,20170630,Stacked memory chip device with enhanced data protection capability,US,6008
9040842,20150526,20130422,Mechanical adhesion of copper metallization to dielectric with partially cured epoxy fillers,US,6008
8838085,20140916,20120426,Use of proximity sensors for interacting with mobile devices,US,24800
8469724,20130625,20111230,Bus bar for power distribution on a printed circuit board,US,6066
9513588,20161206,20150715,Image forming apparatus for forming an image on a recording material,JP,2721
9529477,20161227,20150223,Touch screen panel using digitally encoded light,US,24800
8624920,20140107,20090109,"Image processing apparatus, printing apparatus, and image processing method",JP,2721
10521410,20191231,20151120,Semantic graph augmentation for domain adaptation,US,6066
9443260,20160913,20061221,"System, method, and computer program product for catalog adaptation",US,6066
8553247,20131008,20041213,"Image processing apparatus, control method, storing medium having computer-readable program therein, and program",JP,2721
9176778,20151103,20130305,Background collective operation management in a parallel computer,US,6066
10373360,20190806,20170302,Systems and methods for content-adaptive image stitching,US,24800
8704769,20140422,20080808,Ambidextrous mouse,US,1690
10032819,20180724,20160113,Image sensors and methods of forming the same,KR,104604
8433302,20130430,20080527,System and method for downloading and activating themes on a wirelesss device,US,24800
9627423,20170418,20150825,Solid-state image pickup apparatus and image pickup system having a clipping circuit arranged close to an N-row signal mixing region,JP,2721
10001954,20180619,20141117,"Information processing apparatus, method for controlling the same, and storage medium to identify a function of a register printing apparatus based on printing apparatus type and to display a print screen based on identified function",JP,2721
8398208,20130319,20090116,Ceramic printed circuit board (PCB) and inkjet printhead assembly using the same,KR,104604
9401902,20160726,20140116,Method for exchanging strong encryption keys between devices using alternate input methods in wireless personal area networks (WPAN),US,6008
10366538,20190730,20151019,Method and device for illustrating a virtual object in a real environment,US,1690
9017591,20150428,20120418,Method for manufacturing seamless belt for electrophotography,JP,2721
8701511,20140422,20110322,Inert gas delivery system for electrical inspection apparatus,US,6066
8867623,20141021,20081023,"Method for turbo transmission of digital broadcasting transport stream, a digital broadcasting transmission and reception system, and a signal processing method thereof",KR,104604
9491769,20161108,20120918,Method and system for implementing mobile relay,KR,104604
8391756,20130305,20100512,Image forming apparatus having plurality of image transfer units with stable image transfers,JP,2721
9922689,20180320,20160401,Memory mapping,US,6008
9787816,20171010,20150730,Method for reproducing contents and an electronic device thereof,KR,104604
8913168,20141216,20130314,Solid-state image sensor and image sensing apparatus,JP,2721
8456515,20130604,20060725,Stereo image and video directional mapping of offset,US,24800
9934882,20180403,20150511,"Amine compound and ionic conductive agent, and electroconductive resin composition",JP,2721
10025619,20180717,20171103,Accounting and enforcing non-process execution by container-based software transmitting data over a network,US,6066
8588795,20131119,20090406,Scheduling apparatus and method in a distributed antenna system,KR,104604
8498589,20130730,20080714,Polar modulator with path delay compensation,US,24800
10416698,20190917,20111219,Proximity control using WiFi connection,KR,104604
8725143,20140513,20090818,Methods and systems for handover in WiMAX networks,US,24800
8606570,20131210,20090623,"Imaging apparatus, method of controlling same and computer program therefor",JP,2721
9966974,20180508,20120112,Apparatus and method for providing compatibility of transmission signal in communication system,KR,104604
9576958,20170221,20160609,Forming a semiconductor structure for reduced negative bias temperature instability,US,6066
8413460,20130409,20100622,Lever for dispenser and refrigerator having the same,KR,104604
9678749,20170613,20141222,Instruction and logic for shift-sum multiplier,US,6008
10236917,20190319,20160915,Providing memory bandwidth compression in chipkill-correct memory architectures,US,24800
9565546,20170207,20150630,Enhanced system acquisition while roaming,US,24800
9495805,20161115,20111220,Three dimensional (3D) display terminal apparatus and operating method thereof,KR,104604
9736398,20170815,20150413,"X-ray detecting method, photographing method using the X-ray detecting method, and X-ray detector using the methods",KR,104604
9992184,20180605,20160204,"Method of using server, server reservation control apparatus and program storage medium",JP,9818
8570397,20131029,20111013,Image pickup device and method of picking up image using the same,KR,104604
10345825,20190709,20170103,Detecting an illumination need,US,6066
8355401,20130115,20110802,Controlling access to a destination in a data processing network,US,6066
10497194,20191203,20171013,Communications system and communications apparatus,JP,9818
10481980,20191119,20180329,Enabling segmented source data introspection within dispersed storage network (DSN) memory,US,6066
9372643,20160621,20130412,Data set management,US,6066
8432237,20130430,20090814,"Output circuit with integrated impedance matching, power combining and filtering for power amplifiers and other circuits",US,24800
9070783,20150630,20080227,Semiconductor device and method of manufacturing the same,JP,9818
8566418,20131022,20060504,Configurable system for using Internet services on CE devices,KR,104604
9684992,20170620,20141203,Visualization of objects along a street,US,6066
10342085,20190702,20170908,Back light device and controlling method thereof,KR,104604
9264230,20160216,20110314,Secure key management,US,6066
9923022,20180320,20160701,Array of optoelectronic structures and fabrication thereof,US,6066
9932195,20180403,20170411,"Sheet conveying apparatus, sheet processing apparatus and image forming apparatus",JP,2721
8493625,20130723,20101115,Determining composite color for dithered object and contone object,JP,2721
8964999,20150224,20110311,Audio reproduction device and audio reproduction method,JP,9818
9525686,20161220,20160516,Captcha challenge incorporating obfuscated characters,US,6066
9684578,20170620,20141030,Embedded universal serial bus (USB) debug (EUD) for multi-interfaced debugging in electronic systems,US,24800
9043929,20150526,20120703,Minimizing sensitive data exposure during preparation of redacted documents,US,6066
9880980,20180130,20070305,Document transformation performance via incremental fragment transformations,US,6066
9131432,20150908,20130205,Method and apparatus for efficient and dynamic system reselection procedure for M2M stationary devices,US,24800
9178051,20151103,20120420,Semiconductor device,KR,104604
8413098,20130402,20090429,"T-connections, methodology for designing T-connections, and compact modeling of T-connections",US,6066
8837905,20140916,20100917,Method and apparatus for providing movement guide in video recording device,KR,104604
8830251,20140909,20100723,Method and system for creating an image,KR,104604
9829836,20171128,20160617,Image forming apparatus with pre-exposure member,JP,2721
10277780,20190430,20180103,"Client device, system, information processing method, and recording medium adapted for changing an authentication mode from an individual authentication mode to a common authentication in a case where a transmission of at least first operation information has failed due to an authentication error",JP,2721
9990197,20180605,20170822,Memory management in secure enclaves,US,6008
10084551,20180925,20170223,Generic network infrastructure for nano-communication,US,6066
10250080,20190402,20160331,"Detector, power transmitter, power receiver, power feed system, and detection method",JP,9818
8937633,20150120,20130313,"Lighting apparatus, control method therefor and backlight apparatus",JP,2721
9118356,20150825,20130315,Data transport in portable electronic devices,US,1690
8364304,20130129,20100714,Methods and apparatus for laser scribing wafers,US,6008
9047172,20150602,20121129,Adaptive power control of memory map storage devices,US,6008
9184218,20151110,20141003,Semiconductor memory device having three-dimensional cross point array,KR,104604
9462946,20161011,20150309,Ophthalmologic apparatus and control method for the same,JP,2721
9373800,20160621,20150116,Organic light emitting element having lithium—boron complex,JP,2721
8705457,20140422,20080626,Apparatus and method for transmitting control channel for frequency resource allocation in a wireless communication system,KR,104604
9818655,20171114,20151208,Method and structure for flip-chip package reliability monitoring using capacitive sensors groups,US,6066
9282151,20160308,20080911,Flow control in a distributed environment,US,6066
9367280,20160614,20130806,Dual screen visibility with virtual transparency,US,6008
8667431,20140304,20130305,Test coverage of integrated circuits with masking pattern selection,US,6066
8718541,20140506,20071231,Techniques for optimal location and configuration of infrastructure relay nodes in wireless networks,US,6008
10468491,20191105,20180703,Low resistance contact for transistors,US,6066
9298855,20160329,20080611,Optimization-based visual context management,US,6066
8941564,20150127,20130116,Display device,JP,9818
9098521,20150804,20120112,System and method for managing resources and threshsold events of a multicore portable computing device,US,24800
9904716,20180227,20161102,Optimal analytic workflow,US,6066
8698791,20140415,20110531,Display apparatus and driving method for the same,JP,2721
9628947,20170418,20131204,Wearable map and image display,US,6008
9231738,20160105,20110105,Communication method for relay node and next node of the relay node for network coding,KR,104604
8421382,20130416,20120606,Apparatus motor control method,JP,2721
9971517,20180515,20170322,Accelerated non-volatile memory recirculation processing,US,6066
8866228,20141021,20110923,Diode and electrostatic discharge protection circuit including the same,KR,104604
8655696,20140218,20090115,"System for performing schedule management, schedule management method and program",US,6066
10102240,20181016,20141111,Managing event metrics for service management analytics,US,6066
10163053,20181225,20170106,Coded tags encoded using different magnetic materials and systems of detecting coded tags,US,6066
8705650,20140422,20130802,"Wireless communication system, wireless communication apparatus, and wireless communication method",JP,9818
9142036,20150922,20130411,"Methods for segmenting and encoding an image, and corresponding devices",JP,2721
9928100,20180327,20150929,Adjusting virtual machine migration plans based on alert conditions related to future migrations,US,6066
9330088,20160503,20130423,Preventing frustration in online chat communication,US,6066
9165229,20151020,20130913,Print control apparatus and method for printing images on a continuous sheet,JP,2721
9495162,20161115,20111223,Apparatus and method for performing a permute operation,US,6008
10102152,20181016,20160411,Protecting a memory from unauthorized access,US,6066
10210279,20190219,20101028,"Method, apparatus and software for differentiating two or more data sets having common data set identifiers",US,6066
10165002,20181225,20170223,Identifying an imposter account in a social network,US,6066
8713027,20140429,20100108,Methods and systems for managing electronic messages,US,24800
10015298,20180703,20150831,Phone user interface,US,1690
9229244,20160105,20131218,"Image-blur correction device, image-blur correction method, and image capture apparatus",JP,9818
8724647,20140513,20120913,Searchable television commercials,US,6066
8390747,20130305,20120315,Electronic device in which an electronic component is mounted on a main board,KR,104604
9812571,20171107,20150930,Tensile strained high percentage silicon germanium alloy FinFETs,US,6066
10462063,20191029,20170123,Method and apparatus for detecting packet,KR,104604
9113547,20150818,20081024,Same layer microelectronic circuit patterning using hybrid laser projection patterning (LPP) and semi-additive patterning(SAP),US,6008
8947113,20150203,20120507,Methods for modeling tunable radio-frequency elements,US,1690
8488506,20130716,20110628,Oscillator settling time allowance,US,24800
8368329,20130205,20030911,Method and apparatus for improved cooling fans,US,1690
9331712,20160503,20150821,Compressed caching in a virtual memory system,US,24800
9384430,20160705,20150917,"Image processing apparatus, image processing method, and storage medium",JP,2721
10162687,20181225,20121228,Selective migration of workloads between heterogeneous compute elements based on evaluation of migration performance benefit and available energy and thermal budgets,US,6008
9900001,20180220,20150423,RF circuit with switch transistor with body connection,US,24800
9413361,20160809,20150128,Closed loop clock signal generator with multiple reference clocks,US,1690
9928802,20180327,20130207,Display apparatus for displaying additional information on transparent display region,KR,104604
9477378,20161025,20130313,Method and apparatus for providing a user interface,KR,104604
8686796,20140401,20110419,RF power amplifiers with improved efficiency and output power,US,24800
8592268,20131126,20130415,Semiconductor structures using replacement gate and methods of manufacture,US,6066
9659502,20170523,20151218,Drone range extension via host vehicles,US,6066
9041814,20150526,20121114,Automatic tracking camera system,JP,2721
9798782,20171024,20140605,Re-sizing data partitions for ensemble models in a mapreduce framework,US,6066
9360898,20160607,20110421,Method and terminal for providing user interface using tilt sensor and key input,KR,104604
9277085,20160301,20140812,"Information processing apparatus enabling transmission of file containing link information, control method therefor, and storage medium storing control program therefor",JP,2721
9958637,20180501,20140728,Optical device having improved impact resistance,JP,2721
8862999,20141014,20101122,Dynamic de-identification of data,US,6066
8396316,20130312,20100312,Method and apparatus for processing image,KR,104604
9219298,20151222,20130315,Removal of spurious microwave modes via flip-chip crossover,US,6066
9417803,20160816,20120628,Adaptive mapping of logical addresses to memory devices in solid state drives,US,1690
10126766,20181113,20160721,Low dropout voltage (LDO) regulator including a dual loop circuit and an application processor and a user device including the same,KR,104604
9477437,20161025,20150622,Sharing a graphics-processing-unit display port,US,1690
9825410,20171121,20160908,High-speed connector system,US,1690
9306453,20160405,20150130,DC/DC converter and an image forming apparatus to which a power is supplied from the DC/DC converter,JP,2721
9866555,20180109,20151223,Maintaining user authentications with common trusted devices,US,6008
